query_id,query,task,difficulty,Co-Category,overall_score,category,intent,strengths,weaknesses,improvements,improved_version,human_remarks_on_judge_outputs,requotation_needed,final_requoted_query
Q025,Highlight where the first major contradiction occurs.,Task 1,Medium,Causal,80,Good,Identify and highlight the first point where two opposing ideas or statements start to contradict in a given text.,Clear action required (highlighting); Specific task (identifying contradictions),Lack of context or specific document; No criteria for what constitutes a 'major' contradiction,Specify the text or document to analyze; Define what qualifies as a 'major' contradiction; Provide examples if possible; Clarify if any part of the text should be excluded,Identify and highlight the first major point where two opposing ideas start to contradict in the provided report on climate change.,"Query can be more defined by defining a baseline of what constitutes a major contradiction, no need to define the domain, as the provided transcript will be more than enough to answer that.",TRUE,Identify the first major point of contradiction where one speaker argues for immediate widespread adoption of renewable energy sources to combat climate change while another maintains that reliance on fossil fuels should continue until there are substantial technological improvements in alternative energies.
Q026,Extract moments where both parties talk past each other.,Task 1,Hard,Causal,85,Excellent,Identify instances where two parties are not understanding or addressing each other's points in a conversation.,Addresses an important aspect of communication analysis; Can be applied in various contexts such as conflict resolution and negotiation studies,Lacks specific criteria on what constitutes 'talking past each other'; Does not specify the format or source of the conversation data,"Define clear criteria for identifying when parties are talking past each other; Specify the type and format of input data (e.g., text, audio); Provide examples to clarify the context and expected outcomes","Identify instances where two parties in a conversation fail to address or acknowledge each other's points. Provide clear criteria for what constitutes 'talking past each other' and specify the format of input data (e.g., transcribed text).","Needs to be requoted as defining a clear criteria for identifying when parties are talking past each other can improve this query, no need to provide type of data and example, model has to use the provided transcripts for that.",TRUE,"Find segments within customer service interactions where customers introduce side issues without acknowledgment from agents, potentially affecting issue resolution time."
Q027,Find subtle indicators of customer satisfaction or relief.,Task 1,Easy,Causal,85,Excellent,Identify subtle signs that customers are satisfied or relieved with a product or service.,Addresses a specific business need; Focuses on subtle nuances,"Lacks specific context (e.g., industry, data source); Does not specify the type of indicators to look for","Specify the industry or domain where this is needed; Define what kind of indicators are being sought (e.g., language patterns, sentiment scores); Provide examples of the types of data that will be analyzed",Identify subtle linguistic cues and sentiment scores in customer feedback to determine satisfaction or relief for a retail company's new product line.,"No need for requote, query in itself defines most of the things which should be needed for a model to answer.",FALSE,Find subtle indicators of customer satisfaction or relief.
Q028,Identify where agent explanation appears too vague.,Task 1,Medium,Causal,75,Good,The user wants to find instances where agent explanations are not detailed enough.,Identifies a specific issue (vagueness) in agent explanations; Focuses on a clear aspect of communication quality,Lacks specific criteria for what constitutes 'too vague'; No context about the domain or system being analyzed,"Specify a threshold for vagueness, e.g., less than 50 words; Provide examples of acceptable and unacceptable explanations; Indicate the specific type of agent (e.g., customer service, technical support)",Identify instances where agent explanations are less than 50 words long to ensure they are not too vague for clarity in a customer service context.,"No need for requote, query in itself defines most of the things which should be needed for a model to answer.",FALSE,Identify where agent explanation appears too vague.
Q029,Show turns where customer introduces new information that changes the direction of the call.,Task 1,Hard,Causal,70,Good,Identify customer interactions that significantly alter the course of a call by introducing new information.,Clear objective; Relevant context,Lack of specific criteria for 'new information'; No defined timeframe or call type; Ambiguity in 'direction change',"Define what constitutes 'new information' (e.g., data, facts, requests); Specify the timeframe or context of calls to analyze; Clarify how a direction change is identified",Identify customer interactions in sales calls where new information (such as product features) significantly alters the course of the conversation within the first 10 minutes.,"Definition of new information depends on the particular transcription and no need to change it, model itself will have to detect it on it's own and direction of shifted can be defined but no need to change it here.",FALSE,Show turns where customer introduces new information that changes the direction of the call.
Q030,What exactly do you mean by 'the issue'?,Task 1,Easy,Ambiguous,80,Good,The user is seeking clarification on a term 'the issue' used in a previous context.,Asks for specific clarification; Context is clear from the term used,Lacks explicit mention of when 'the issue' was discussed; No additional context provided to aid in understanding,Specify the context or conversation where 'the issue' was mentioned; Provide more details about what aspect of 'the issue' is unclear; Ask for examples if needed for better understanding,Could you please clarify what you meant by 'the issue' in our last discussion on project timelines?,"As this question is for ambiguity check, no need to requote.",FALSE,What exactly do you mean by 'the issue'?
Q032,Show where the customer was unhappy,Task 1,Easy,Ambiguous,85,Excellent,The user wants to find records where customers expressed dissatisfaction.,Clear action required (show records); Specific emotion provided ('unhappy'),Lack of context or specific dataset mentioned; No timeframe specified for the unhappy period,Specify the exact column name where sentiment is recorded; Add a timeframe to narrow down the search; Clarify if 'unhappy' refers to a specific field or overall sentiment,"Show records where customer sentiment was marked as 'unhappy' in the feedback column, specifically from January 2023 onwards.","As this question is for ambiguity check, no need to requote.",FALSE,Show where the customer was â€˜unhappyâ€™.
Q033,Can you identify the problematic tone I mentioned earlier?,Task 1,Medium,Ambiguous,85,Excellent,The user wants to know if the assistant has recognized a tone they previously mentioned as problematic.,Asks about a specific issue from past interaction; Direct and clear request,Lacks explicit mention of the problematic tone's nature or specifics; No indication of when this tone was mentioned,Specify the context or conversation where the tone was mentioned; Describe the characteristics of the problematic tone more clearly; Indicate if there are any specific actions needed regarding the tone,Could you confirm if the tone I flagged earlier as 'problematic' during our last meeting is what you've identified? Please provide details on how it can be addressed.,"As this question is for ambiguity check, no need to requote.",FALSE,Can you identify the â€˜problematic toneâ€™ I mentioned earlier?
Q035,What does ˜the big misunderstanding refer to?,Task 1,Medium,Ambiguous,75,Good,The user wants to know the specific meaning or context behind the phrase 'the big misunderstanding'.,Clear intent; Specific phrase provided,"Lack of context about where the phrase was used; Ambiguity in what kind of answer is expected (e.g., historical, cultural)",Provide more context on the setting or source of 'the big misunderstanding'; Specify if you are looking for a general explanation or a specific instance; Ask about potential implications or consequences of this misunderstanding,"Can you provide more context on where you encountered the phrase 'the big misunderstanding', and what kind of information would be most useful to understand its meaning?","As this question is for ambiguity check, no need to requote.",FALSE,What does â€˜the big misunderstandingâ€™ refer to?
Q036,Show the part where the customer concern escalated,Task 1,Hard,Ambiguous,50,Average,Identify sections in a customer service record where the issue the customer faced became more serious without a clear definition of what 'escalated' means.,Asks for identification of a key process (escalation) in customer service records.; Focuses on a critical aspect of customer experience.,"Lack of definition for 'escalated' makes the query ambiguous.; No specific timeframe or context is provided, limiting scope.; May require additional context to be fully actionable.","Define what constitutes an escalation (e.g., multiple follow-ups, increased urgency).; Specify a time frame for the records to be analyzed.; Include any relevant customer or service interaction details that could help define 'escalation'.","Identify instances where the issue faced by customers became more serious over time. Define what constitutes an escalation (e.g., multiple follow-ups, increased urgency) and specify a timeframe for analysis.","No, customer's concern escalated has enough meaning in it's own for model to understand and respond.",FALSE,Show the part where the customerâ€™s â€˜concern escalatedâ€™- no clear definition provided.
Q037,Find where the agent lost control of the call.,Task 1,Hard,Ambiguous,50,Average,"The user wants to find instances where an agent lost control during a call, which is subjective and may vary in interpretation.",Identifies a specific issue (agent losing control); Focuses on a particular aspect of call handling,Lacks clear definition of 'lost control'; No specific context or timeframe provided; Subjective nature makes it hard to quantify,"Define what constitutes 'losing control' (e.g., agent interrupting, call going silent); Specify a time period for the search; Provide more context about the calls in question",Identify instances where an agent's interruption or prolonged silence during a call indicates they lost control of the conversation. Search within the last month.,"Yes, definition of lost control is really needed to get the model to get a proper context and reasoning to get the desired response, if not given it creates the situation ambiguity.",FALSE,Find where the agent â€˜lost control of the callâ€™- very subjective.
Q039,What exactly constitutes strong evidence in this transcript?,Task 1,Hard,Ambiguous,75,Good,The user wants to understand what qualifies as strong evidence within a given transcript.,Asks for a specific concept; Context is provided (transcript),Lacks specific transcript details; Does not specify the domain,"Include more context about the transcript's subject matter; Specify if this is for legal, scientific, or another field; Provide a sample of what might be considered strong evidence in the given context","In the context of [specific domain], what exactly constitutes â€˜strong evidenceâ€™ in this transcript about [brief description of the topic]?","Yes, context about the strong evidence is needed, domain will be provided along the transcript.",FALSE,What exactly constitutes â€˜strong evidenceâ€™ in this transcript?
Q040,Show where the customer requested a refund amount over $500.,Task 1,Easy,Causal,98,Excellent,The user wants to know about customer refund requests exceeding $500.,Specific monetary threshold provided; Clear action (showing) and subject (refund requests),Lack of date range or time frame; No mention of specific customers or products; Assumption that the database contains such records,"Add a timeframe for the query, e.g., 'in the last year'; Specify if only certain types of refunds are relevant; Clarify if this is about all customers or specific ones",Show where the customer requested a refund amount over $500 in the last year.,No change needed in the question and even the mention of time and date is specific and not needed everytime.,FALSE,Show where the customer requested a refund amount over $500.
Q041,Find the silence longer than 12 seconds.,Task 1,Easy,Hallucination Check,85,Excellent,Identify intervals of silence that exceed 12 seconds in length.,Clear action required (finding silence); Specific duration mentioned,No context provided about data source or format; Assumes knowledge of what constitutes 'silence',Specify the type of media or data being analyzed; Clarify if silence is defined by audio levels or other criteria; Provide a sample dataset for better understanding,"Identify intervals of complete audio silence in a video file, where each interval lasts longer than 12 seconds.","As the transcript which is going to be given has no time stamp, it is not possible to answer this question, but if model does answer this, model's sanity check is needed.",FALSE,Find the silence longer than 12 seconds.
Q042,Locate the supervisor handoff event.,Task 1,Medium,Hallucination Check,75,Good,The user wants to find information about supervisor handoff events.,Clear intent; Specific topic,"Lack of context (e.g., specific timeframe, organization); Ambiguity in 'supervisor handoff' (could refer to different scenarios)",Specify the organization or department; Clarify what aspects of supervisor handoffs are needed; Provide a timeframe for the events,Find all supervisor handoff events within our company from January to December 2023.,"There is nothing like this in the transcripts, so if model does answer this and creates something which is not possible to provide, it questions the model's sanity.",FALSE,Locate the supervisor handoff event.
Q043,Show where the agent logged an internal note.,Task 1,Medium,Hallucination Check,98,Excellent,The user wants to know where an internal note was logged by a specific agent.,Clear action required (showing information); Specific topic (internal notes and agents),Lack of context about the system being queried; No mention of time frame or additional filters,Specify the agent's name or ID for more precise results; Add a date range to narrow down the search; Clarify if this is for a specific case or general information,"Show where Agent Smith logged an internal note between January 1, 2023, and December 31, 2023.","This question didn't specify which type of internal log, it is upto model descrition, but for the transcripts we are providing, there is no possibility of this, so this ultimately checks the model's sanity.",FALSE,Show where the agent logged an internal note.
Q044,Identify the call duration from the transcript.,Task 1,Medium,Hallucination Check,90,Excellent,Determine the length of a phone call based on a provided transcript.,Clear action required; Realistic task for an LLM,No specific context provided; Assumes transcript contains relevant information,"Specify where in the transcript to look; Request a summary of key points alongside duration; Clarify if exact time format is needed (e.g., minutes, hours)","Extract the call duration from the provided transcript, focusing on the first half of the conversation.","As the transcript which is going to be given has no time stamp, so if model handles this question differently like calculating the call duration in terms of words, sentences or speaker turn basis it is better, if not, model's sanity check is needed.",FALSE,Identify the call duration from the transcript.
Q045,Locate the customers loyalty tier.,Task 1,Hard,Hallucination Check,78,Good,The user wants to find out which loyalty tier a specific customer belongs to.,The intent is clear and specific; Feasibility is high for an LLM,No customer identifier provided; Lack of context about the system being queried,"Specify a unique customer identifier (e.g., customer ID, email); Indicate if any additional information is needed to resolve the query; Clarify the source or database where the loyalty tier data is stored",Identify the customerâ€™s loyalty tier by providing their customer ID.,"As the transcript being passed to the model has nothing other than call conversation between customer and agent, there can be no way to find the loyalty tier of the customer, other than checking the sentiment of the customer but it is too not a defined method to do, so if model does not give a proper reasoning for it's response, which does make sense, it ultimately questions the model's sanity",FALSE,Locate the customerâ€™s loyalty tier.
Q046,Find the agent's talk-listen ratio.,Task 1,Hard,Ambiguous,70,Good,Determine the ratio of time an agent spends talking versus listening during interactions.,Clear intent; Relevant metric for performance evaluation,"No specific timeframe or context provided; Assumes availability of detailed interaction logs; Does not specify how to handle different types of interactions (e.g., calls vs. chats)","Specify a time period for the analysis, e.g., 'for the last quarter'; Clarify if this is an ongoing or one-time request; Define what constitutes talking and listening in the context of different interaction types","Calculate the talk-listen ratio for all agent interactions over the past month, considering both calls and chats.","As the transcript which is going to be given has no time stamp, so if model handles this question differently like calculating the talk-listen ration in terms of words, it is better, if not, model's sanity check is needed.",FALSE,Find the agent's talk-listen ratio.
Q047,Show where the system assigned a CSAT score.,Task 1,Hard,Hallucination Check,90,Excellent,The user wants to know about instances where a Customer Satisfaction (CSAT) score was automatically assigned by the system.,Clear intent; Specific topic (CSAT score); Realistic expectation of automated systems,Lack of specific timeframe or context; No mention of system or platform; Ambiguity in 'where' - could refer to location or database,"Specify the time period for the query; Identify the specific system or platform being queried; Clarify if 'where' refers to a physical location or data storage; Add any relevant filters (e.g., customer segment, product category)",Provide details on when and where the system automatically assigned CSAT scores for a particular platform or database.,"As the transcript which is going to be given has no CSAT score mention, this question is just there to check model's sanity and check if it's hallucinating and not creating something new on it's own",FALSE,Show where the system assigned a CSAT score.
Q048,Identify whether the customer churned after the call.,Task 1,Hard,Causal,75,Good,Determine if a customer left the service after a call.,Asks for a specific outcome (churn); Refers to a clear event (call),Lacks context about the dataset or timeframe; Does not specify what constitutes churn,"Specify the time period of the call in question; Define what 'churn' means for the business (e.g., cancellation, non-renewal); Include the customer ID to focus on a specific individual","Determine if Customer XYZ churned after their last call on March 15, 2023, based on whether they canceled or did not renew their service.","Does not need much change in the question as the question is self explanatory except the mention of time of call, yes we do need to either gave that as the context or mention in the question. And I do think mentioning or explaining the churn whould help the model reason better but it also put a restriciton on the capability itself as well.",FALSE,Identify whether the customer churned after the call.
Q050,Locate the first point in the conversation where the customer hints at wanting a refund using indirect phrasing.,Task 1,Medium,BusinessOutcome,70,Good,Identify the initial moment in a conversation where the customer indirectly expresses interest in requesting a refund.,"Focuses on identifying an initial hint, which can be useful in customer service; Indirect phrasing is common and this query addresses it","Lack of specific context makes the task ambiguous; No defined criteria for what constitutes a 'hint'; Does not specify the format or medium of the conversation (e.g., chat, call)",Specify the type of conversation and provide examples of indirect phrasing related to refunds; Define clear criteria for identifying hints towards a refund request; Include sample transcripts to better understand the context,"Analyze a customer service chat transcript to find the first instance where the customer indirectly expresses dissatisfaction that could lead to a refund request, such as mentioning delivery delays or product quality issues.",The type of conversation is already given to the RAG model and it has just to answer the question based on the context given. And mentioning of the example request does let us check that model is not just using our examples and able to think for itself.,FALSE,Locate the first point in the conversation where the customer hints at wanting a refund using indirect phrasing.
Q051,"Based on the conversation, what evidence can we use to support that the customer’s dissatisfaction is not just due to a one-time incident but a recurring issue with the company's services?",Task 1,Hard,Causal,76,Good,Identify evidence from a conversation to demonstrate that customer dissatisfaction is ongoing rather than isolated.,Asks for evidence-based support; Focuses on identifying trends,Lacks specific context about the services involved; Does not specify the timeframe of the incidents; May require additional data beyond the conversation transcript,Specify the relevant service or product in question; Define a clear time frame for the incidents; Request examples of recurring complaints from the transcript; Ask about any previous interactions that might indicate a pattern,"From our conversation, can we find evidence showing that customer dissatisfaction with [specific service/product] is ongoing rather than an isolated incident? Please provide examples of similar issues mentioned over the past [X months/years].",No need to improve anything in this query.,FALSE,"Based on the conversation, what evidence can we use to support that the customer’s dissatisfaction is not just due to a one-time incident but a recurring issue with the company's services?"
Q052,Can you tell me how many conversations in the corpus involve discussions about different travel plans?,Task 1,Easy,Causal,75,Good,The user wants to know the count of conversations in a dataset that discuss multiple travel plans.,Asks for a specific metric (count of conversations); Refers to a clear topic (travel plans),Lacks definition of 'corpus'; Does not specify criteria for 'different' travel plans,"Define the term 'corpus' more clearly; Specify how 'different' travel plans should be identified (e.g., distinct users, unique destinations); Clarify if partial mentions of travel plans are included in the count; Indicate whether the corpus is a specific dataset or a general one",Could you tell me how many conversations in the travel plan database involve discussions about at least two distinct travel plans?,No need to improve anything in this query.,FALSE,Can you tell me how many conversations in the corpus involve discussions about different travel plans?
Q053,Can you provide evidence from the conversation logs that show instances where customers were dissatisfied with the services?,Task 1,Medium,Causal,75,Good,The user wants to find evidence in conversation logs that demonstrates customer dissatisfaction with services.,Specific request for evidence; Clear topic of interest (customer dissatisfaction),Lack of specific timeframe or criteria; No mention of desired format of evidence,"Specify a time period for the logs to be searched; Define what constitutes 'evidence' (e.g., direct quotes, sentiment analysis scores); Request a summary or report format for the findings","Could you provide a summary of instances from our conversation logs between January and March 2023 where customers expressed dissatisfaction with our services, including any direct complaints or negative feedback?",No need to improve anything in this query.,FALSE,Can you provide evidence from the conversation logs that show instances where customers were dissatisfied with the services?
Q054,"Based on the conversation data, can we identify any specific patterns or behaviors that can get a customer to churn?",Task 1,Hard,Causal,75,Good,The user wants to know if there are any identifiable patterns or behaviors in customer conversation data that could predict customer churn.,Asks for specific patterns or behaviors; Focuses on churn prediction,Lacks specific data sources or metrics; Does not specify time frame or sample size; Limited context on what constitutes churn,"Specify the exact dataset to be used; Define clear criteria for churn; Include a timeframe for analysis; Request specific types of patterns (e.g., frequency, sentiment)",Can we analyze our customer conversation data from Q1 2023 to identify any specific patterns or behaviors that predict customer churn based on negative sentiments and frequent complaints?,No need to improve anything in this query.,FALSE,"Based on the conversation data, can we identify any specific patterns or behaviors that can get a customer to churn?"
