query_id,query,task,difficulty,Co-Category,overall_score,category,intent,strengths,weaknesses,improvements,improved_version,human_remarks_on_judge_outputs,requotation_needed,final_requoted_query
Q075,"In calls where an agent suggests a replacement product or service instead of a refund, what are the specific phrases or words that agents use to justify their suggestion for a replacement over a refund? Specifically, identify patterns in the types of justifications used by agents during these conversations.",Task1,MEDIUM,Causal,86,Excellent,Identify patterns in justifications used by agents for suggesting a replacement product or service over a refund,Specific focus on agent conversations; Asks for identification of patterns; Provides context for analyzing call transcripts,"Query lacks specific examples or data sources; Limited to call transcript analysis; Does not specify the scope of the analysis (e.g., all calls, specific types of calls)","Include specific examples or data sources; Expand the scope of analysis beyond call transcripts; Specify the scope of the analysis (e.g., all calls, specific types of calls); Consider analyzing other customer service channels","Analyze patterns in phrases or words used by agents when suggesting a replacement product or service over a refund, using specific examples and data sources from various customer service channels.","Expanding beyond call transcripts changes the scope of the task. The original correctly focuses on call data, which aligns with the provided context.",FALSE,"In calls where an agent suggests a replacement product or service instead of a refund, what are the specific phrases or words that agents use to justify their suggestion for a replacement over a refund? Specifically, identify patterns in the types of justifications used by agents during these conversations."
Q076,"How do customers hesitation fillers (""um"", ""uh"") correlate with the success rate of agents convincing them towards accepting a replacement over a refund? Analyze instances where multiple hesitations are used and observe any changes in agent communication style to determine if these affect the negotiation outcome.",Task1,HARD,Causal,86,Excellent,"The user is trying to analyze the correlation between customer hesitation fillers and success rate of agents convincing them towards accepting a replacement over a refund, observing changes in agent communication style and their impact on negotiation outcome.",The query is specific and well-defined; It seeks to analyze both customer behavior and agent communication styles; It aims to identify patterns that could potentially improve negotiation outcomes,The query lacks context about the dataset or the nature of the interactions; It does not specify a timeframe for the analysis; It does not provide details about the criteria used to define success in negotiations,"Provide more context about the dataset and the nature of the interactions; Specify a timeframe for the analysis; Define success criteria for negotiations; Consider analyzing other factors that may influence negotiation outcomes, such as customer preferences or agent training","Analyze the correlation between customer hesitation fillers ('um', 'uh') and the success rate of agents convincing customers towards accepting a replacement over a refund in customer-agent interactions from our dataset, focusing on instances where multiple hesitations are used. Observe changes in agent communication style during these interactions and determine if they affect negotiation outcomes. Provide analysis for a specific timeframe (e.g., Q1 2023) and define success criteria for negotiations.",Adding timeframes and success criteria would constrain the analysis. The original query appropriately leaves these open for the agent to reason about.,FALSE,"How do customersâ€™ hesitation fillers (""um"", ""uh"") correlate with the success rate of agents convincing them towards accepting a replacement over a refund? Analyze instances where multiple hesitations are used and observe any changes in agent communication style to determine if these affect the negotiation outcome."
Q077,"Query comparing customer satisfaction scores when agents start explaining return policies with phrases like 'sure, let me explain our return policy' versus 'I understand you want to return your item and here is the policy'",Task1,MEDIUM,Causal,86,Excellent,User is comparing customer satisfaction scores based on different phrases used by agents when explaining return policies,The query is specific and clear about the comparison it wants to make; It provides context for the two different phrases being compared; The question is feasible as it can be answered using existing data sources,"The query could benefit from more specificity regarding the data sources and time period being considered; There is no mention of any control group or baseline for comparison; The query does not specify whether satisfaction scores are based on customer feedback, agent performance evaluations, or some other metric","Include specific data sources and time period being considered; Specify the methodology for measuring customer satisfaction (e.g., customer feedback, agent performance evaluations); Consider including a control group or baseline for comparison; Consider refining the question to focus on a more specific aspect of the interaction between agents and customers","Compare customer satisfaction scores when agents use phrases like 'sure, let me explain our return policy' versus 'I understand you want to return your item and here is the policy', based on customer feedback from the past 6 months, using a control group of interactions where no return policy was explained.",The judge’s improvements add unnecessary specifics like control groups and timeframes. The original query is straightforward and tests the agent’s ability to compare based on given phrases.,FALSE,"Query comparing customer satisfaction scores when agents start explaining return policies with phrases like 'sure, let me explain our return policy' versus 'I understand you want to return your item and here is the policy'"
,,,,,,,,,,,,,,
,,,,,,,,,,,,,,
