query_id,query,task,difficulty,Co-Category,overall_score,category,intent,strengths,weaknesses,improvements,improved_version,human_remarks_on_judge_outputs,requotation_needed,final_requoted_query
Q001,Identify the turn where the first misunderstanding between customer and agent occurs.,Task 1,Medium,Causal,70,Good,To find the point in a conversation where a customer and agent first misunderstand each other.,Specific goal stated; Focus on identifying a turning point,No context provided about the nature of the misunderstanding; Assumes availability of a detailed conversation transcript,"Specify what type of misunderstanding (e.g., language, tone); Request additional context if needed (e.g., industry, customer profile); Clarify if the transcript is available or needs to be provided; Suggest using specific keywords or phrases for better accuracy",Identify the point in the conversation where a language-related misunderstanding first occurs between the customer and agent. Please provide the full transcript of their interaction.,"An improved version of this query is not needed because it is intentionally left non-specific to keep the difficulty medium, requiring the RAG agent to rely on broader context from the transcript.",FALSE,Identify the turn where the first misunderstanding between customer and agent occurs.
Q002,"What specific phrases indicate the customer is becoming frustrated, and at which parts of the conversation do they appear?",Task 1,Medium,Causal,75,Good,Identify phrases that show customer frustration and their locations in a conversation.,"Asks for specific phrases which aids in precise analysis; Focuses on identifying frustration, a clear objective","Does not specify what type of conversation (e.g., phone call, chat); Lacks examples or context to guide the analysis","Specify the type of interaction (phone call, chat, etc.); Provide sample phrases for reference; Ask for both phrases and tone indicators if applicable; Clarify what constitutes a 'part' of the conversation",Identify specific phrases or tone indicators that show customer frustration in a phone call interaction. Provide their locations within the conversation.,"The type of interaction is not specified so the RAG agent should consider all interaction types, keeping the query difficulty medium so the RAG agent needs to retrieve more contextual documents.",FALSE,"What specific phrases indicate the customer is becoming frustrated, and at which parts of the conversation do they appear?"
Q003,"At what point does the agent first take ownership of the issue, and how does the customer respond?",Task 1,Medium,Causal,70,Good,The user wants to know when an agent first takes ownership of a problem and how the customer reacts.,Asks for specific points in a process; Involves interaction between two parties,Lacks context about the issue type or industry; Does not specify desired format of response,"Specify the context (e.g., support ticket, product issue); Clarify if a specific time frame is needed; Request for both agent and customer actions","In a customer support scenario, at what point does the agent first take ownership of a product issue, and how does the customer respond to this action?","Not specifying the query is intentional; it forces the agent to understand the transcripts and reason across them more deeply. Adding a more specific requotation would reduce this intended difficulty, so it isn’t needed.",FALSE,"At what point does the agent first take ownership of the issue, and how does the customer respond?"
Q004,Extract the agents earliest apology and describe what event immediately led to it.,Task 1,Medium,Causal,70,Good,Identify the earliest apology made by an agent and specify the event that prompted it.,Asks for a specific piece of information (earliest apology); Requires understanding of temporal and contextual relationships,Lacks explicit time frame or date range; Does not specify if 'event' refers to the customer's action or the company's response,"Specify a time period (e.g., within the last year); Clarify whether the event is the customer's issue or the company's response; Add context about the type of apology (written, verbal, etc.); Indicate if multiple apologies are acceptable",Identify the earliest written apology made by an agent within the last year and describe the event that prompted it.,The intent understood by the judge is correct and the improved query is so very similar so the requotaion was not needed.,FALSE,Extract the agents earliest apology and describe what event immediately led to it.
Q005,Identify places where the customer repeats the same request and explain why they may have done so.,Task 1,Hard,Causal,76,Good,To find instances where customers repeatedly ask for the same information and understand potential reasons behind their behavior.,"Identifies a specific area of interest (repeated customer requests); Aims to understand the underlying reasons, which can be valuable; Can lead to improved customer service strategies",Lacks specific context or data sources for analysis; Does not specify what type of information is being requested repeatedly; May require additional details on customer behavior and interaction history,"Specify the type of request (e.g., product information, refund process) to narrow down the scope; Include a timeframe for the analysis to ensure relevance; Request data sources or specific interactions to analyze more accurately",Analyze customer interactions over the past month to identify instances where they repeatedly ask about return policies and provide insights into why this might be happening.,"The requoted query is very clear and carrying the same intent as the original query, so retaining the original query might not hurt evaluation as it tests the agent on its query understanding capabilities given the task is in hard category.",FALSE,Identify places where the customer repeats the same request and explain why they may have done so.
Q006,"Which turn most likely triggered the customer's escalation request, based solely on textual clues?",Task 1,Hard,Causal,70,Good,Determine which customer service interaction most likely caused a escalation based on text.,Focuses on textual analysis; Aims to identify root cause,Lacks specific criteria for 'turn'; No defined context or dataset,"Specify what constitutes a 'turn' (e.g., messages, calls); Provide sample text or data to train on; Define the scope of interactions being analyzed",Identify which customer service interaction most likely caused the escalation based on textual clues from a provided dataset of customer service exchanges.,The judge suggestion of adding scope to the query can be considered. Having many transcripts under analysis changes the task and evaluation of agent directly. Score assigned to the query should be lower. Although the changes suggested about the scope and asking to state instances is not needed.,TRUE,"What specific concerns about the refund process, if any, prompted the customer to escalate their complaint?"
Q007,Find instances where the agent provides conflicting information and describe the impact on customer confusion.,Task 1,Very Hard,Causal,75,Good,Identify situations where an agent's responses are contradictory and assess how such conflicts affect customer understanding.,Addresses a common issue in customer service; Requires analysis of multiple data points,Lack of specific context or examples; Difficulty quantifying the impact without additional information; Assumes availability of relevant interaction data,Specify a dataset or type of interactions to analyze; Request more details on what constitutes 'conflicting information'; Provide criteria for measuring customer confusion,"Analyze agent-customer interactions from the past month, identifying instances where the agent provides conflicting information and assess how such contradictions impact customer understanding.",Mentioning the time span like month reduces the scope of analysis. Keeping the original query retains the difficulty of the task.,FALSE,Find instances where the agent provides conflicting information and describe the impact on customer confusion.
Q008,Locate all moments where the customer expresses hesitation and explain what might have caused them.,Task 1,Medium,Causal,70,Good,Identify instances where customers show hesitation and determine potential causes.,"Addresses a specific need for understanding customer behavior; Can be applied in various contexts (e.g., sales, support)",Lacks specificity on what constitutes 'hesitation'; Does not specify the source of data or context,"Define clear indicators for hesitation; Specify the type of data (e.g., text, audio) and sources; Request a focus on specific scenarios or products",Identify moments where customers express hesitation in their responses to product features. Analyze these instances to determine potential causes such as price concerns or doubts about functionality.,This query covers all instances where customer might have hesitated; and gives deeper insights of transcripts.,FALSE,Locate all moments where the customer expresses hesitation and explain what might have caused them.
Q009,Identify where the agent attempts reassurance and evaluate how effective it seems.,Task 1,Medium,Causal,75,Good,To find instances where an agent provides reassurance and assess their effectiveness.,"Identifies a specific task (analyzing reassurance); Asks to evaluate effectiveness, providing a clear goal",Lacks specific criteria for evaluating effectiveness; Does not specify the context or type of agent interactions; No mention of what constitutes 'reassurance',Specify the criteria for effective reassurance; Define the context or type of interactions to analyze; Clarify how effectiveness will be measured,"Analyze instances where a customer service agent provides reassurance, using predefined criteria such as tone and response time. Evaluate their effectiveness based on customer satisfaction scores.",The improvement provided by the judge is insightful and will push the RAG agent to reason more on the transcripts to define what type of reassurance was given. Score assigned to the query should be lower. Although the scope is limited to call transcripts.,TRUE,"Evaluate the effectiveness of the agent’s reassurance based on the customer's subsequent responses (e.g., satisfaction scores or follow-up behaviors) in the transcript."
Q010,Determine the turn after which the conversation becomes more adversarial.,Task 1,Hard,Causal,70,Good,Identify the point in a conversation where it transitions from cooperative to adversarial.,Addresses a specific aspect of conversation analysis; Requires understanding of conversational dynamics,Lack of defined criteria for 'adversarial'; No sample data provided for training; Assumes the existence of clear adversarial turns,Define what constitutes an adversarial turn more clearly; Provide a dataset or examples to train on; Specify how to handle ambiguous cases in conversations,"Identify the specific turn in a conversation where it transitions from cooperative to adversarial, based on predefined criteria such as tone and content.","Defining how the RAG agent should infer a transition from cooperative to adversarial behavior helps improve transcript analysis. This ensures the RAG agent must reason correctly about shifts in tone, intent, and conversational content, rather than relying on superficial cues. Score assigned to the query should be lower. Although the suggestion to provide the dataset is not needed as the rag agent will be working on given call transcripts.",TRUE,"Identify the first turn in which a participant uses aggressive language or makes an accusation, indicating a shift from cooperative to adversarial behavior."
Q011,Identify a sequence of three or more turns showing a misunderstanding progressively worsening.,Task 1,Very Hard,Causal,70,Good,To find a series of three or more exchanges where participants' misunderstandings progressively escalate.,Focuses on a specific pattern (sequence of misunderstandings); Requires multiple-step reasoning,Lack of context or domain specificity; Vague terms like 'progressively worsening' are subjective,"Specify the context or medium (e.g., email, chat) for better analysis; Define what constitutes a misunderstanding more clearly; Provide examples to clarify the escalation pattern","Analyze a sequence of three or more exchanges in an email thread where participants' misunderstandings progressively worsen, indicating increasing confusion and disagreement.",The medium of conversation is limited to call transcripts in the defined problem so requotation here is not needed.,FALSE,Identify a sequence of three or more turns showing a misunderstanding progressively worsening.
Q012,Find requests where the customer seeks clarification and describe what triggered it.,Task 1,Medium,Causal,75,Good,Identify customer requests for clarification and determine the trigger.,Focuses on specific customer behavior; Aims to understand underlying reasons,Lack of explicit criteria for 'seeking clarification'; No defined scope or dataset size,Define clear indicators for seeking clarification; Specify a relevant context or domain; Provide sample data points for better understanding,Identify customer requests for clarification in support tickets and specify the trigger event that prompted each request.,Specifying the domain or cotext here will restrict the scope.,FALSE,Find requests where the customer seeks clarification and describe what triggered it.
Q013,Highlight all customer statements indicating disbelief or skepticism.,Task 1,Medium,Causal,75,Good,Identify customer statements that express doubt or uncertainty about a product or service.,Specific keywords are identified for skepticism.; Skepticism is a clear concept to analyze.,No context provided about the domain or specific language.; Effectiveness could be improved with more detailed instructions.,"Specify the domain (e.g., customer service, product reviews).; Provide examples of statements to look for.; Clarify what action will be taken with identified statements.",Analyze customer feedback from a recent product launch and highlight any statements expressing doubt or uncertainty about its features or performance.,The intent of original query doesn't limit the scope of the transcripts.,FALSE,Highlight all customer statements indicating disbelief or skepticism.
Q014,Determine where policy explanations begin and how the customer reacts.,Task 1,Medium,Causal,70,Good,Identify the start of policy explanations and customer reactions in a document.,Identifies specific areas of interest; Focuses on two distinct elements: policy explanations and customer reactions,Lacks context about the type of document or format; Does not specify what form the output should take; Ambiguity in how 'begin' is interpreted for policy explanations,"Specify the type of document (e.g., contract, email) and its format; Clarify if 'begin' means to locate the start or describe their content; Define the expected output format (e.g., list, summary)",Identify where policy explanations begin in a customer service agreement and how customers react to these policies within the document.,The suggested query is similar to the original query and the improvements suggested are not necessary.,FALSE,Determine where policy explanations begin and how the customer reacts.
Q015,Point out moments where agent over-talking or long explanations contributed to confusion.,Task 1,Medium,Causal,75,Good,Identify instances where an agent's excessive talking or detailed explanations led to confusion.,Clear intent; Specific topic focus,Lack of context on what constitutes 'confusion'; No mention of a specific scenario or interaction type,"Specify the context in which over-talking occurs (e.g., customer service, sales call); Define what exactly counts as confusion; Provide examples of confusing moments for better understanding",Identify instances where an agent's excessive talking or detailed explanations during a customer service interaction led to confusion.,The improved query is very similar to the original query. And the 'stating instances' task is expected in the original problem statement.,FALSE,Point out moments where agent over-talking or long explanations contributed to confusion.
Q016,Identify when the agent first signals a corrective action and how tone shifts.,Task 1,Medium,Causal,75,Good,Determine the initial instance of a corrective action by an agent and analyze any changes in tone that follow.,"Focuses on specific actions (corrective) and their context (tone); Asks for a temporal analysis, which is clear; Requests an analysis of tone changes, providing direction",Lacks explicit mention of the data source or format; Does not specify what kind of corrective actions are being considered; Doesn't clarify if 'tone' refers to language used or emotional content,"Specify the data source and format (e.g., call logs, chat transcripts); Define the types of corrective actions that should be identified; Clarify whether 'tone' refers to linguistic style or sentiment analysis; Add a timeframe if applicable for when these actions are expected","Analyze the earliest instance of an agent's corrective action in call logs, and determine how the tone shifts after such actions. Specify the types of corrective actions (e.g., policy violations) and clarify whether 'tone' refers to language used or sentiment.","Clarifying what change in tone is useful, and expected from the rag agent. Score assigned to the query should be lower. Although the suggestion of specifying medium like call logs is not needed as it is limited to call transcripts and the suggestion of specifying format is also not needed as the call transcripts will be directly available to the rag agent.",TRUE,Identify the first instance where the agent acknowledges a mistake and how their language shifts to address it.
Q017,Extract all agent uncertainty instances and explain their impact.,Task 1,Hard,Causal,70,Good,The user wants to identify all instances where agents exhibit uncertainty and understand their implications.,Clear identification of a specific topic; Direct request for analysis,"Lack of defined scope (e.g., domain, timeframe); No mention of desired format or depth of explanation",Specify the context or domain where agents operate; Define a time frame for the instances; Request a specific format for the explanations,"Identify all instances of uncertainty exhibited by agents in our customer service department from January to December 2023, and provide detailed explanations of their impact on customer satisfaction.","Specifying timeframe is not expected, and the original expects the rag agent to explain the impacts.",FALSE,Extract all agent uncertainty instances and explain their impact.
Q018,Identify parts where the customer contradicts the agent and explore why.,Task 1,Very Hard,Causal,75,Good,To find instances where a customer disagrees with an agent and understand the reasons behind these disagreements.,Identifies a specific task (finding contradictions); Aims to understand underlying causes,Lacks specific criteria or metrics for disagreement; Does not specify the format of input data; No mention of expected output or analysis depth,"Specify a clear definition of 'contradiction'; Provide sample inputs and outputs; Indicate the type of data (transcripts, chat logs) to be analyzed",Analyze customer-agent interactions to identify specific instances where the customer contradicts the agent's statements. Provide reasons for these contradictions based on context.,The original query is enough to ask the rag agent to identify parts where the customer contradicts the agent.,FALSE,Identify parts where the customer contradicts the agent and explore why.
Q019,Find areas where contextual information is missing from the agent.,Task 1,Medium,Causal,70,Good,Identify sections in agent interactions where relevant context is lacking.,Addresses an important aspect of interaction quality; Can be useful for improving user experience,Lacks specific criteria or examples for 'contextual information'; Does not specify the format or source of agent interactions,"Define what constitutes 'contextual information' (e.g., relevant background, user history); Specify the type and format of agent interactions to be analyzed; Provide examples of areas where context is typically missing","Analyze agent interactions to identify gaps in contextual information such as user history or previous conversations. Specify the types of interactions (e.g., chat logs, voice recordings) for a comprehensive analysis.",The original query is sufficient because by missing context we meant that agent doesnt know about the context of issue or customer information.,FALSE,Find areas where contextual information is missing from the agent.
Q020,Identify the earliest sign of a booking-related misunderstanding.,Task 1,Medium,Causal,85,Excellent,To find out when a booking-related misunderstanding first appeared.,"Uses clear, concise language; Focuses on a specific issue",Lacks context about the source of booking data; Does not specify what type of misunderstanding is being referred to; No timeframe or criteria for identifying the sign,"Specify the source of booking data (e.g., CRM, email logs); Define the types of misunderstandings that are relevant; Provide a timeframe within which to search for the earliest sign","Identify the earliest instance in our CRM where a customer expressed confusion about their booking details, indicating an initial misunderstanding.","The remark provided by judge feels correct, but it seems that judge to be approving more specific queries.",FALSE,Identify the earliest sign of a booking-related misunderstanding.
Q021,Locate where the agent attempts to redirect the conversation and assess effectiveness.,Task 1,Hard,Causal,70,Good,Identify instances where an agent redirects a conversation and evaluate the success of such redirections.,Identifies a specific task (analyzing conversation redirections); Asks for evaluation of effectiveness; Focuses on agent actions,Lacks specific criteria for evaluating effectiveness; Does not specify the context or type of conversations; No mention of desired output format,"Specify criteria for assessing redirections (e.g., user satisfaction, time saved); Define the scope of conversations to be analyzed; Request a structured output format (e.g., list of instances with ratings)",Identify and evaluate instances where an agent redirects a conversation based on predefined criteria. Provide a structured summary of successful redirections.,The original query seems to be fined. Keeping the scope broad to maintain the difficulty level.,FALSE,Locate where the agent attempts to redirect the conversation and assess effectiveness.
Q022,Determine where the conversation deviates from intended call flow.,Task 1,Hard,Causal,70,Good,Identify points in a conversation where the flow diverges from the planned path.,Addresses a specific issue in conversational analysis; Requires understanding of planned vs. actual interaction,Lacks explicit criteria for what constitutes a deviation; Does not specify the format or medium of the conversation; No mention of tools or data sources to use,"Specify clear criteria for identifying deviations; Clarify the context and format of the conversation (e.g., text, audio); Identify relevant tools or datasets that can be used; Provide examples of intended vs. actual call flows","Define the criteria for identifying where a conversation deviates from its planned flow in a specific context, such as a customer service call, and specify how to analyze both text and audio data.",The changes provided in the improved query is not needed. The original query is correct to evaluate the rag agent.,FALSE,Determine where the conversation deviates from intended call flow.
Q023,Find the turn where the customer first expresses urgency.,Task 1,Medium,Causal,75,Good,Identify the point in a conversation where a customer first shows urgency.,Focuses on a specific aspect of customer communication; Realistic for an LLM to process,Lack of context about what constitutes 'urgency'; No specified format or criteria for urgency detection; Ambiguity in defining the start of a conversation,"Define specific phrases or words that indicate urgency; Specify the format of the conversation (e.g., text, audio); Provide examples of what constitutes urgency in this context","Identify the first instance where the customer uses urgent language such as 'urgent', 'immediate', or 'now' during our interaction.",,FALSE,Find the turn where the customer first expresses urgency.
Q024,Identify signals that the customer is losing patience.,Task 1,Medium,Causal,85,Excellent,To find indicators suggesting a customer's growing frustration or dissatisfaction.,Uses a common business term ('patience'); Implies a proactive approach,Lacks specific metrics or indicators; Doesn't specify industry context; Ambiguous on what constitutes 'losing patience',Specify key performance indicators (KPIs) related to customer satisfaction; Provide a timeframe for the analysis; Clarify the desired output format or data sources,"Identify specific KPIs and early warning signs that indicate a customer is losing patience within the next month, focusing on common metrics like response time and complaint frequency.","No need for requote, query in itself defines most of the things which should be needed for a model to answer and improvements mentioned are not needed and are just a extra burden for a model to think and reason upon.",FALSE,Identify signals that the customer is losing patience.
