query_id,query,task,difficulty,Co-Category,overall_score,category,intent,strengths,weaknesses,improvements,improved_version,human_remarks_on_judge_outputs,requotation_needed,final_requoted_query
Q055,Can you identify recurring complaints where customers say they submitted documents or information multiple times but still face delays?,Task 1,Medium,Causal,76,Good,The user wants to find out if there are common complaints where customers report resubmitting documents or information repeatedly yet still experience delays.,Clear topic focus on recurring issues; Relevant context provided,Lack of specific timeframe or dataset mentioned; No mention of desired outcome format; Ambiguity in 'still face delays' phrasing,"Specify a time period for the analysis; Clarify the expected output (e.g., report, dashboard); Define what constitutes a delay to ensure consistency; Include any relevant data sources or datasets",Can you analyze customer complaints from the past six months to identify recurring issues where customers reported resubmitting documents multiple times but still faced delays? Please provide a summary report detailing these patterns.,No need to improve anything in this query.,FALSE,Can you identify recurring complaints where customers say they submitted documents or information multiple times but still face delays?
Q056,Which conversations show customers expressing frustration due to inconsistent answers from different agents?,Task 1,Hard,Causal,76,Good,Identify customer conversations where frustration arises from receiving conflicting information from various agents.,Focuses on a specific issue (inconsistent answers); Aims to identify emotional states (frustration) in text; Can be applied to large datasets,Lack of defined criteria for 'frustration'; No specified timeframe or context; Assumes consistent data format across conversations,"Define clear indicators for frustration (e.g., specific phrases, tone analysis); Specify a time frame for the analysis; Clarify the expected output format and depth of results","Identify customer service conversations where customers express frustration due to receiving inconsistent answers from different agents over the past month. Use keywords like 'confused', 'disappointed', or 'inconsistent' in your search.",No need to improve anything in this query.,FALSE,Which conversations show customers expressing frustration due to inconsistent answers from different agents?
Q057,Can you provide examples where customers explicitly state they were not informed about missing or incorrect documents during a claim or verification process?,Task 1,Easy,Causal,75,Good,The user wants examples where customers clearly mentioned they were unaware of missing or incorrect documents during a claim or verification process.,Specific focus on customer statements; Clear context provided,Limited scope to only explicit mentions; No specified timeframe or industry,Specify a timeframe for the search; Include industries or types of claims if relevant; Request both positive and negative examples for balanced analysis,"Could you provide examples from customer feedback where customers explicitly stated they were unaware of missing or incorrect documents during their claim process, preferably within the last year?",No need to improve anything in this query.,FALSE,Can you provide examples where customers explicitly state they were not informed about missing or incorrect documents during a claim or verification process?
Q058,How often do agents acknowledge responsibility for internal errors (such as missing updates or incorrect information) during conversations?,Task 1,Medium,Causal,76,Good,The user wants to know the frequency with which agents admit responsibility for mistakes during customer interactions.,Asks about a specific aspect of customer service quality; Clear on what kind of errors are being considered,"Lacks a defined timeframe for the query; Does not specify the source of the data (e.g., internal reports, surveys); May require subjective interpretation of 'acknowledgment'","Specify a time period (e.g., monthly or quarterly) to focus on; Identify the specific sources of data for analysis; Clarify what constitutes an 'acknowledgment' of responsibility","What is the monthly frequency with which agents acknowledge responsibility for internal errors, such as missing updates or incorrect information, during customer conversations based on internal reports?",No need to improve anything in this query.,FALSE,How often do agents acknowledge responsibility for internal errors (such as missing updates or incorrect information) during conversations?
Q059,Can you identify instances where poor communication or misunderstanding between the agent and customer extended the call duration unnecessarily?,Task 1,Hard,Causal,76,Good,The user wants to understand if communication issues between agents and customers led to longer call durations.,Asks for a specific scenario; Focuses on a common issue in customer service,Lacks specific metrics or criteria; Does not specify time frames or industries; Could be more detailed about the impact of extended calls,Specify key performance indicators (KPIs) for call duration; Define a timeframe for analysis; Include industry context if relevant; Clarify what actionable results are expected,"Could you analyze instances where poor communication or misunderstandings between agents and customers extended calls beyond 5 minutes, specifically in the retail sector from Q1 to Q3 of this year?",No need to improve anything in this query.,FALSE,Can you identify instances where poor communication or misunderstanding between the agent and customer extended the call duration unnecessarily?
Q060,"Which transcripts contain clear examples of agents providing proactive solutions, such as fast-tracking a case or offering follow-up support?",Task 1,Easy,Causal,76,Good,The user wants to identify transcripts where agents have offered proactive solutions like fast-tracking a case or providing follow-up support.,Specific examples of desired outcomes are provided; Relevant context is given for proactive solutions,Lack of a clear definition of 'proactive solutions'; No specified timeframe or domain for the transcripts,Define what constitutes a 'proactive solution' more clearly; Specify a timeframe or context for the transcripts; Include examples of proactive actions in the query; Clarify if any specific industries or types of cases are relevant,"Identify transcripts from the last quarter where agents provided proactive solutions, such as fast-tracking a case or offering follow-up support, by highlighting these specific actions.",No need to improve anything in this query.,FALSE,"Which transcripts contain clear examples of agents providing proactive solutions, such as fast-tracking a case or offering follow-up support?"
Q061,"How many conversations involve escalations due to unresolved issues, and what common factors trigger these escalations?",Task 1,Medium,Causal,76,Good,The user wants to know the frequency of conversations that involve escalations due to unresolved issues and identify common factors causing these escalations.,Asks for both quantitative (number of conversations) and qualitative (common factors) information; Focuses on a specific issue (unresolved issues leading to escalations),"Lacks specific time frame or context for the data analysis; Does not specify the source of the data (e.g., customer service logs, support tickets); May require additional clarification on what constitutes an 'escalation'","Specify a time period for the analysis (e.g., last quarter, past year); Clarify the definition of 'escalations' and 'unresolved issues'; Identify the specific channels or departments where these conversations occur; Request additional context such as customer demographics if relevant","What is the frequency of escalations due to unresolved issues in our customer service over the past year, and what are the common factors that trigger these escalations across different support channels?",No need to improve anything in this query.,FALSE,"How many conversations involve escalations due to unresolved issues, and what common factors trigger these escalations?"
Q062,"Which transcripts show customers expressing confusion about the status of their verification or claim, and what explanations do agents provide?",Task 1,Medium,Causal,76,Good,Identify transcripts where customers are confused about their verification or claim status and understand the agents' responses.,"Asks for specific content (transcripts, customer confusion, agent responses); Focuses on a clear business objective (customer service analysis)",Lacks specific criteria for 'confusion' or 'explanations'; Does not specify the context or industry; May require manual review of identified instances,"Define what constitutes 'confusion' (e.g., use of certain keywords); Specify the type of claims or verifications involved; Request a summary or categorization of findings for better actionability","Identify transcripts where customers express confusion about their claim or verification status, and provide specific examples of agentsâ€™ explanations. Categorize these instances by common reasons for customer confusion.",No need to improve anything in this query.,FALSE,"Which transcripts show customers expressing confusion about the status of their verification or claim, and what explanations do agents provide?"
Q063,In how many transcripts do customers explicitly mention being unaware of an important policy or rule that affected their request?,Task 1,Easy,Causal,76,Good,Determine the frequency with which customers express unawareness of a specific policy or rule in their interactions.,Focuses on a specific aspect of customer interactions; Aims to uncover potential policy communication gaps,Lacks specificity regarding which policy or rule is being referred to; Does not specify the time frame for the transcripts; May miss nuanced expressions of unawareness without explicit words,Specify the exact policy or rule in question; Define a clear time period for the analysis; Include context around 'unaware' to capture nuances; Consider adding a threshold for how explicitly 'unaware' must be stated,"In which transcripts do customers explicitly mention being unaware of the policy regarding late fees, specifically from January 2023 onwards?",No need to improve anything in this query.,FALSE,In how many transcripts do customers explicitly mention being unaware of an important policy or rule that affected their request?
Q064,Which conversations reveal discrepancies between what previous agents told the customer and what the current agent explains?,Task 1,Hard,Causal,76,Good,Identify conversations where there are inconsistencies in information provided to a customer by different agents.,Addresses a specific issue (inconsistencies) in customer service; Can be applied to large datasets of conversations,Lack of defined criteria for what constitutes a discrepancy; May require significant data processing and analysis resources,Specify clear criteria for identifying discrepancies; Provide examples or a definition of 'discrepancies'; Limit the scope to a specific timeframe or type of conversation; Include context on how to handle identified inconsistencies,"Identify conversations where there are inconsistencies in information provided to a customer by different agents, based on predefined criteria such as conflicting facts or contradictory statements.",No need to improve anything in this query.,FALSE,Which conversations reveal discrepancies between what previous agents told the customer and what the current agent explains?
Q065,"Do customers from different domains (Insurance, Travel, Telecom, etc.) describe different primary causes for delays in their requests?",Task 1,Hard,Causal,76,Good,Determine if customers from various industries report different primary reasons for delays in their service requests.,"Asks for a comparison between multiple industry sectors; Focuses on primary causes, which can be quantified",Lacks specific data sources or time frames; Does not specify what type of service requests are being considered,"Specify the industries to include/exclude; Define the types of service requests (e.g., billing, support, etc.); Provide a timeframe for the analysis; Clarify if historical data or real-time feedback is needed","Analyze customer feedback from Insurance, Travel, Telecom, and other industries to determine if there are significant differences in the primary causes of delays across these sectors, focusing on support service requests over the past year.",No need to improve anything in this query.,FALSE,"Do customers from different domains (Insurance, Travel, Telecom, etc.) describe different primary causes for delays in their requests?"
Q066,Can we extract examples where the agent openly admits that the company made an error or overlooked a customer submission?,Task 1,Easy,Causal,76,Good,The user wants to find instances where an agent acknowledges a company's mistake or oversight regarding a customer submission.,Clear topic focus; Specific request for acknowledgment of errors,"Lack of specific timeframe or domain; No mention of desired format (e.g., text, case studies)","Specify a time period to narrow the search; Indicate if any particular company or industry is relevant; Request the format of the examples (text, case studies, etc.)",Can we find instances from 2021 onwards where an agent in the customer service department acknowledged a company's error or oversight regarding a customer submission? Please provide text excerpts for each example.,No need to improve anything in this query.,FALSE,Can we extract examples where the agent openly admits that the company made an error or overlooked a customer submission?
Q067,"Where do agents highlight long-term customer loyalty (e.g., multiple years using the service), and how does it influence the resolution offered?",Task 1,Medium,Causal,76,Good,The user wants to know where agents emphasize long-term customer loyalty and how this affects the resolution provided.,Specific focus on a particular aspect of customer service; Direct question about the impact of loyalty,"Lack of context regarding industry or specific company; Ambiguity in 'where' agents highlight this (e.g., during calls, emails)",Specify the industry or type of service being discussed; Clarify if 'where' refers to communication channels or other contexts; Add a question about potential strategies for improving long-term loyalty,"In which communication channels do agents typically highlight long-term customer loyalty (e.g., multiple years using the service), and how does this influence the resolution offered in banking services?",No need to improve anything in this query.,FALSE,"Where do agents highlight long-term customer loyalty (e.g., multiple years using the service), and how does it influence the resolution offered?"
Q068,Can we identify transcripts where the agent initially denies a request but later reverses the decision after reviewing additional information?,Task 1,Hard,Causal,70,Good,The user wants to find transcripts where an agent initially rejects a request and then changes their decision upon further review.,Clear intent; Specific scenario,Lack of specific criteria for 'additional information'; No mention of data source or format; Limited context on what constitutes a reversal,"Specify the criteria for 'additional information' that triggers the reversal; Identify the data source and format (e.g., CRM system, file type); Define clear parameters for what counts as a reversal decision","We need to analyze transcripts from our customer service database where an agent initially denies a request but later reverses the decision after reviewing specific types of additional information, such as new evidence or policy updates.",No need to improve anything in this query.,FALSE,Can we identify transcripts where the agent initially denies a request but later reverses the decision after reviewing additional information?
Q069,"Can we find examples where agents independently offer extra steps, like prioritizing a claim or personally monitoring a ticket, without being asked?",Task 1,Easy,Causal,75,Good,"The user wants to know if there are instances where customer service agents proactively take additional actions, such as prioritizing a claim or monitoring a ticket, without being prompted by the company.","Asks about a specific behavior (proactive actions); Focuses on a particular type of action (prioritizing, monitoring)","Lacks specific timeframe or industry context; Does not specify the source of examples (internal reports, case studies, etc.)","Add a timeframe to narrow down the search; Specify an industry or company for more targeted results; Identify potential sources of data (internal reports, customer feedback, etc.)",Can we find examples from the last year where agents in the telecommunications industry proactively prioritized claims or monitored tickets without being asked? Where can these examples be sourced from?,No need to improve anything in this query.,FALSE,"Can we find examples where agents independently offer extra steps, like prioritizing a claim or personally monitoring a ticket, without being asked?"
Q070,"Which conversations involve customers raising more than one issue during the same call, and how does the agent manage the transitions between them?",Task 1,Medium,Causal,76,Good,Identify customer calls where multiple issues are raised and understand the agent's handling of these issues.,Asks for specific analysis of customer and agent behavior; Focuses on a clear business objective (call handling efficiency),Lacks specific data points or metrics for evaluation; Does not specify the time frame for the analysis,"Specify the time period for the analysis; Request specific metrics to quantify agent performance; Clarify what aspects of transition management are most important (e.g., speed, clarity)","Identify customer calls where multiple issues were raised within a specified timeframe and analyze how agents managed transitions between these issues, focusing on the speed and clarity of handling each issue.",No need to improve anything in this query.,FALSE,"Which conversations involve customers raising more than one issue during the same call, and how does the agent manage the transitions between them?"
Q071,"In calls where agents mention a loyalty program and immediately follow up with a discount or reward, how frequently do customers use hesitation words ('um', 'uh') compared to other calls?",Task1,MEDIUM,Causal,86,Excellent,"The user is trying to compare the frequency of hesitation words ('um', 'uh') in calls where agents mention a loyalty program and immediately follow up with a discount or reward, to other calls.",The query is specific and well-defined; It seeks actionable insights; It compares two sets of data,"The query does not specify the timeframe or call volume for comparison; It assumes that all hesitation words indicate customer hesitation, which may not always be the case; It does not clarify how 'other calls' are defined",Specify a timeframe and call volume for comparison; Refine the definition of 'hesitation words'; Define 'other calls' more clearly,"In calls from a specific timeframe, where agents mention a loyalty program and immediately follow up with a discount or reward, how frequently do customers use hesitation words ('um', 'uh') compared to other calls during the same timeframe?",The judge’s suggestions to add a timeframe and define terms are reasonable but would reduce the query’s difficulty. The original query is already clear and intentionally broad to test the RAG agent’s ability to reason across all available transcripts without unnecessary constraints.,FALSE,"In calls where agents mention a loyalty program and immediately follow up with a discount or reward, how frequently do customers use hesitation words ('um', 'uh') compared to other calls?"
Q072,"How does the use of empathy phrases like ""I can understand why you feel that way"" from agents correlate with customer acceptance of terms and conditions in loyalty program discussions?",Task1,HARD,Causal,81,Good,The user is trying to understand the correlation between empathy phrases used by agents and customer acceptance of terms and conditions in loyalty program discussions.,"The query is specific and focused on a particular aspect of customer interactions.; It asks for a correlation, which can be quantified and analyzed.",The query lacks context about the specific loyalty program or agent interactions being considered.; It does not specify the timeframe or sample size of the data to be analyzed.,"Provide more details about the loyalty program and the agent interactions under consideration.; Specify the timeframe and sample size for the data analysis.; Consider including variables that might influence the correlation, such as the type of empathy phrase used or the customer demographic.","How does the use of empathy phrases like 'I can understand why you feel that way' from agents in [Loyalty Program Name] discussions correlate with customer acceptance of terms and conditions, considering a sample size of [Sample Size] over a time period of [Timeframe], while controlling for variables such as the type of empathy phrase used and customer demographic?","Adding details like sample size and timeframe overcomplicates the query. The original is adequately focused on the causal relationship, and the RAG agent should handle it with the provided context.",FALSE,"How does the use of empathy phrases like ""I can understand why you feel that way"" from agents correlate with customer acceptance of terms and conditions in loyalty program discussions?"
Q073,"In calls where agents discuss delay issues, how frequently do successful agents use proactive language (""Let's explore options together"") versus reactive language (""I understand you're frustrated""), and what is the effect on customer satisfaction?",Task1,MEDIUM,Causal,90,Excellent,"The user is trying to analyze call data to understand the frequency of proactive and reactive language used by successful agents during delay discussions, and its impact on customer satisfaction.",The query is clear and specific about the data to be analyzed; It provides a clear objective: understanding the frequency of certain language usage; It considers the impact on customer satisfaction,The query does not define what constitutes a 'successful' agent or call; It does not specify the timeframe for the analysis; It does not provide details about how customer satisfaction is measured,Define criteria for a successful agent or call; Specify the timeframe for the analysis; Provide details about how customer satisfaction is measured; Consider analyzing unsuccessful calls for comparison,"In calls where agents discuss delay issues, analyze the frequency of successful agents using proactive language ('Let's explore options together') versus reactive language ('I understand you're frustrated'), and compare this with customer satisfaction ratings over a specified timeframe.","Defining success criteria and adding a timeframe would make the query more precise, but the original is intentionally open to allow the agent to infer from context. This maintains the intended difficulty.",FALSE,"In calls where agents discuss delay issues, how frequently do successful agents use proactive language (""Let's explore options together"") versus reactive language (""I understand you're frustrated""), and what is the effect on customer satisfaction?"
Q074,"When agents acknowledge customer concerns about delays, such as 'sure mia i'm sorry uh i hear about the delays' (Skybridge Airlines transcript), and then offer potential solutions like suggesting future plans or immediate alternatives, as shown in the Shopsquare transcript where an agent asks 'could you um tell me more about what youâ€™d like to uh discuss regarding the insurance offerings'",Task1,HARD,Causal,81,Good,Customer is expressing concern about delays and seeking potential solutions or further discussion on alternative options,The query provides a specific example of customer concern; It shows an agent offering potential solutions; The query is relevant to customer service scenarios,The query lacks clarity in the context of the conversation; It does not provide complete information about the delays or specific insurance offerings; There is no clear request for action from the customer,"Provide more context about the delays and their impact on the customer; Specify the type of delays (flight, service, etc.); Include a specific question or request from the customer; Offer more detailed solutions or alternatives",Could you tell me more about the delays I'm experiencing with Skybridge Airlines and provide potential solutions or alternative options for my travel plans?,"The original query is fragmented and unclear. The improved version correctly rephrases it into a coherent, actionable question, making it much better for the agent to process.",TRUE,Can the agent summarize the customer's concerns about flight delays and propose at least two alternative travel options?
